heading,description
Donimo Drivers,"is a puzzle I designed where dice can walk over the dominoes or drive them around. (1 player, 4 dice, and double-six dominoes)"
Adding Donimoes,"is a puzzle I designed where you add dominoes in the given order. (1 player, double-six dominoes)"
Tetromino Road,"is a board game I designed where you lay out dominoes with roads between them. (2 players, double-six dominoes, beads and coins)"
Writing Rules,"is a section to help me remember how to create the different types of diagrams."
Solutions,
